"Maker_URI","Description","Object_URI","Collector Information","Title","Owner","Place Made","Maker Birth Date","Maker Death Date","Home Location URI","Measurements","Category_URI","Category","Materials_URI","Materials","Collector_Information_typeURI","Nationality_URI","Nationality","Maker_Appellation_URI","Maker","Credit Line","How Acquired?","Acquisition_URI"
"E21_Person---dev#classLink","E22_Man-Made_Object---P3_has_note","E22_Man-Made_Object---dev#classLink","E33_Linguistic_Object---P3_has_note","E35_Title---rdf-schema#label","E40_Legal_Body---rdf-schema#label","E48_Place_Name---rdf-schema#label","E52_Time-Span---P82_at_some_time_within","E52_Time-Span---P82_at_some_time_within","E53_Place---dev#classLink","E54_Dimension---P3_has_note","E55_Type---dev#classLink","E55_Type---rdf-schema#label","E55_Type---dev#classLink","E55_Type---rdf-schema#label","E55_Type---dev#classLink","E74_Group---dev#classLink","E74_Group---rdf-schema#label","E82_Actor_Appellation---dev#classLink","E82_Actor_Appellation---rdf-schema#label","E8_Acquisition---P3_has_note","E8_Acquisition---P3_has_note","E8_Acquisition---dev#classLink"
"","Antelope skull on desert floor.  Ground view point.  Frame painted as part of image.","","","Antelope","","","","","","i 14 1/4 x 32 1/8  f 14 1/2 x 32 1/4","","PAINTING","","Oil on Canvas with painted metal frame","","","","","O'Keeffe, Georgia","This purchase made possible by previous donations from Sandy Scott and the Widener Charitable Limited Partnership, with additional assistance from Adrienne and John Mars, Anne and John Marion, Ann and Richard O’Leary, Chuck D. Miller, Peggy and Lowry Mays","",""
"","Big horn sheep standing in a pack on a steep mountain side.  The sheep are all looking over to the viewers right.  There are clouds in the background.","","","In the Clouds","National Museum of Wildlife Art","Canada","","","","i 30 x 40  f 36 1/4 x 46 1/4","","PAINTING","","Oil on Canvas","","","","","Rungius, Carl","JKM Collection, National Museum of Wildlife Art","RSGBK Lease Agreement; then Museum Purchase",""
"","IO and hard file reviewed - 11-2008.  Jaguar climbing down rock outcropping.  Based on studies of Senor Lopez, a jaguar from Paraguay that was the first feline occupant of the Lion House at the Bronx Zoo.","","","Reaching Jaguar","Robert S. and Grayce B. Kerr Foundation","France","","","","o 44 1/2 x 37 x 20 1/2","","SCULPTURE","","Bronze","","","","","Huntington, Anna Hyatt","JKM Collection, National Museum of Wildlife Art","RSGBK Loan Agreement",""
"","A pack of wigeons sit on small muddy islands in a lake.  Grass grows out of the water.  The sun is setting and the golden reflection glows on the surface of the water.","","","Settled for the Night (American Wigeons)","Robert S. and Grayce B. Kerr Foundation","","","","","i 31 1/4 x 47, f 33 1/4 x 49","","PAINTING","","Oil on Canvas","","","","","Jonsson, Lars","JKM Collection, National Museum of Wildlife Art","RSGBK Loan Agreement",""
"","Long, horizontal painting of the elk refuge in winter.  The open fields and mountains are covered in snow and the refuge is filled with elk.","","","The Refuge","National Museum of Wildlife Art","","","","","i 35 x 119, f 44 3/4 x 129 1/2","","PAINTING","","Oil on Canvas","","","","","Smith, Tucker","JKM Collection, National Museum of Wildlife Art","RSGBK Lease Agreement; then Museum Purchase",""
"","Turkey","","","Benjamin's Emblem","","","","","","i: 44 x 31","","PRINT","","Etching, Aquatint, and Drypoint on Paper","","","","","Ford, Walton","Gift of the 2009 and 2010 Collectors Circles, National Museum of Wildlife Art","Purchase",""
"","Sculpture of a bear lying on its stomach on a rock.","","","Waiting for Sockeye","","","","","","o 71 1/2 x 109 x 58","","SCULPTURE","","Bronze","","","","","Ullberg, Kent","Generously sponsored by Mr. and Mrs. Anthony Greene and Trailside Galleries, National Museum of Wildlife Art","Gift",""
